<?xml version="1.0" encoding="UTF-8" ?>
<!DOCTYPE users SYSTEM "user.dtd">
<users>
    <user id="TB10001" country="Chinese" source="Android">
        <id>10001</id>
        <name>admin</name>
        <password>111111</password>
        <salary><![CDATA[salary > 15000 & salary < 30000]]></salary>
    </user>

    <user id="TB10002" country="Chinese" source="IOS">
        <id>10002</id>
        <name>tony</name>
        <password>666666</password>
        <salary>
            <![CDATA[
                salary > 15000 & salary < 30000
            ]]>
        </salary>
    </user>
</users>